{
  "versao": "2.0",
  "data_geracao": "2026-08-14",
  "metadados_projeto": {
    "tese_base": "SOARES, Maria Angélica Lau Pereira. Visão da Modernidade: A Presença Britânica no Gabinete de Leitura (1837-1838). 209f. Dissertação (Mestrado em Estudos Lingüísticos e Literários em Inglês) — Universidade de São Paulo, São Paulo, 2006.",
    "escopo": "Ambiente editorial, intelectual, institucional e histórico do Gabinete de Leitura (1837-1838).",
    "fonte_primaria": "TESE_MARIA_ANGELICA_LAU_PEREIRA_SOARES.pdf",
    "principio_filiacao": "Tese é fonte de verdade primária. JSONs anteriores (grafo_conhecimento_tese_maria_angelica.json) tratados como rascunhos; divergências registradas no relatorio_divergencias.md.",
    "paginacao": {
      "regra_global": "Não há offset universal garantido para toda a dissertação; nas páginas pré-textuais a distância varia.",
      "mapeamento_verificado": [
        {
          "secao": "Capítulo 6 (A nação britânica no Gabinete de Leitura)",
          "pagina_impressa_inicio": 76,
          "pagina_pdf_inicio": 84,
          "offset": 8,
          "metodo_verificacao": "Marcador 'Capítulo 6' encontrado no PDF p.84 = impressa p.76 (confirmado via pdftotext -layout)."
        }
      ],
      "instrucao_consumidor": "Cada evidência armazena explicitamente pagina_pdf_* e pagina_impressa_* quando disponíveis. Consumidores nunca devem derivar uma a partir da outra em tempo de execução."
    }
  },
  "vocabulario_controlado": {
    "tipos_no": [
      "Tese",
      "Capitulo",
      "Secao",
      "Periodico",
      "Fasciculo",
      "Instituicao",
      "Tipografia",
      "Livraria",
      "Pessoa",
      "ObraAbstrata",
      "ManifestacaoTextual",
      "Conceito",
      "Tema",
      "MovimentoLiterario",
      "Local",
      "ReferenciaBibliografica",
      "Evidencia",
      "Argumento"
    ],
    "tipos_aresta": [
      "AUTORA_DE",
      "ORIENTA",
      "ANALISA",
      "PUBLICADA_EM",
      "IMPRESSA_EM",
      "VENDIDA_EM",
      "REDIGE",
      "COLABORA_COM",
      "CONTRIBUI_PARA",
      "REPUBLICADA_EM",
      "RELACIONA_SE_A",
      "CITA",
      "SUSTENTA",
      "ASSOCIA_SE_A",
      "CONTEXTO_DE",
      "INTEGRA",
      "INFLUENCIA",
      "TEM_TEMA"
    ],
    "status_epistemologico": [
      "documentado",
      "identificado",
      "inferido",
      "hipotese",
      "problematico",
      "nao_identificado"
    ]
  },
  "nos": [
    {
      "id": "tese:soares:2006",
      "tipo": "Tese",
      "titulo": "Visão da Modernidade — A presença britânica no Gabinete de Leitura (1837-1838)",
      "aliases": [
        "Dissertação Maria Angélica Lau Pereira Soares"
      ],
      "atributos": {
        "autora": "Maria Angélica Lau Pereira Soares",
        "ano": 2006,
        "instituicao": "USP / FFLCH / Departamento de Letras Modernas",
        "orientadora": "Sandra Guardini Teixeira Vasconcelos",
        "programa": "Pós-Graduação em Estudos Lingüísticos e Literários em Inglês"
      },
      "status_epistemologico": "documentado",
      "evidence_ids": [],
      "observacao": "Fonte primária deste grafo. Por isso não possui evidence_ids próprios."
    },
    {
      "id": "capitulo:1-continuar-se-a",
      "tipo": "Capitulo",
      "titulo": "Capítulo 1: Continuar-se-á",
      "aliases": [],
      "atributos": {
        "pagina_impressa_inicio": 1,
        "pagina_impressa_fim": 12,
        "pagina_pdf_inicio": 9,
        "pagina_pdf_fim": 20,
        "descricao": "Apresenta o Gabinete de Leitura, seus redatores e as condições de produção da imprensa da época."
      },
      "status_epistemologico": "documentado",
      "evidence_ids": [
        "evidence:soares:2006:pdf-p9-12:redatores-gabinete"
      ],
      "observacao": null
    },
    {
      "id": "capitulo:2-o-que-e-gabinete",
      "tipo": "Capitulo",
      "titulo": "Capítulo 2: O que é um GABINETE DE LEITURA?",
      "aliases": [],
      "atributos": {
        "pagina_impressa_inicio": 13,
        "pagina_impressa_fim": 24,
        "pagina_pdf_inicio": 21,
        "pagina_pdf_fim": 32,
        "descricao": "Discute o conceito de gabinete de leitura e sua chegada à corte do Rio de Janeiro."
      },
      "status_epistemologico": "documentado",
      "evidence_ids": [
        "evidence:soares:2006:pdf-p9-12:redatores-gabinete"
      ],
      "observacao": null
    },
    {
      "id": "capitulo:3-viagem-prefacio",
      "tipo": "Capitulo",
      "titulo": "Capítulo 3: Viagem à roda d'um prefácio",
      "aliases": [],
      "atributos": {
        "pagina_impressa_inicio": 25,
        "pagina_impressa_fim": 40,
        "pagina_pdf_inicio": 33,
        "pagina_pdf_fim": 48,
        "descricao": "Analisa o prefácio do Gabinete de Leitura como manifesto editorial."
      },
      "status_epistemologico": "documentado",
      "evidence_ids": [
        "evidence:soares:2006:pdf-p9-12:redatores-gabinete"
      ],
      "observacao": null
    },
    {
      "id": "capitulo:4-missao-intelectual",
      "tipo": "Capitulo",
      "titulo": "Capítulo 4: A missão do intelectual",
      "aliases": [],
      "atributos": {
        "pagina_impressa_inicio": 41,
        "pagina_impressa_fim": 62,
        "pagina_pdf_inicio": 49,
        "pagina_pdf_fim": 70,
        "descricao": "Discute a missão do intelectual no Brasil pós-Independência e o papel da literatura."
      },
      "status_epistemologico": "documentado",
      "evidence_ids": [
        "evidence:soares:2006:pdf-p9-12:redatores-gabinete"
      ],
      "observacao": null
    },
    {
      "id": "capitulo:5-visoes-albion",
      "tipo": "Capitulo",
      "titulo": "Capítulo 5: Visões da Albion",
      "aliases": [],
      "atributos": {
        "pagina_impressa_inicio": 63,
        "pagina_impressa_fim": 75,
        "pagina_pdf_inicio": 71,
        "pagina_pdf_fim": 83,
        "descricao": "Apresenta como a nação britânica era vista pela jovem intelectualidade brasileira."
      },
      "status_epistemologico": "documentado",
      "evidence_ids": [
        "evidence:soares:2006:pdf-p9-12:redatores-gabinete"
      ],
      "observacao": null
    },
    {
      "id": "capitulo:6-nacao-britanica-no-gabinete",
      "tipo": "Capitulo",
      "titulo": "Capítulo 6: A nação britânica no Gabinete de Leitura",
      "aliases": [],
      "atributos": {
        "pagina_impressa_inicio": 76,
        "pagina_impressa_fim": 137,
        "pagina_pdf_inicio": 84,
        "pagina_pdf_fim": 145,
        "descricao": "Analisa os textos britânicos no Gabinete (Galeria Parlamentar + prosa de ficção britânica)."
      },
      "status_epistemologico": "documentado",
      "evidence_ids": [
        "evidence:soares:2006:pdf-p9-12:redatores-gabinete"
      ],
      "observacao": null
    },
    {
      "id": "capitulo:consideracoes-finais",
      "tipo": "Capitulo",
      "titulo": "Considerações Finais",
      "aliases": [],
      "atributos": {
        "pagina_impressa_inicio": 138,
        "pagina_impressa_fim": 139,
        "pagina_pdf_inicio": 146,
        "pagina_pdf_fim": 147,
        "descricao": "Síntese da tese: o sentimento de 'atraso' do Brasil e o papel dos periódicos."
      },
      "status_epistemologico": "documentado",
      "evidence_ids": [
        "evidence:soares:2006:pdf-p9-12:redatores-gabinete"
      ],
      "observacao": null
    },
    {
      "id": "secao:secao:6-1-galeria-parlamentar",
      "tipo": "Secao",
      "titulo": "Seção 6.1 — A Galeria Parlamentar",
      "aliases": [],
      "atributos": {
        "pagina_impressa_inicio": 76,
        "pagina_impressa_fim": 82,
        "capitulo_pai": "capitulo:6-nacao-britanica-no-gabinete"
      },
      "status_epistemologico": "documentado",
      "evidence_ids": [
        "evidence:soares:2006:pdf-p9-12:redatores-gabinete"
      ],
      "observacao": null
    },
    {
      "id": "secao:secao:6-2-prosa-ficcao-britanica",
      "tipo": "Secao",
      "titulo": "Seção 6.2 — A prosa de ficção britânica no Gabinete de Leitura",
      "aliases": [],
      "atributos": {
        "pagina_impressa_inicio": 82,
        "pagina_impressa_fim": 137,
        "capitulo_pai": "capitulo:6-nacao-britanica-no-gabinete"
      },
      "status_epistemologico": "documentado",
      "evidence_ids": [
        "evidence:soares:2006:pdf-p9-12:redatores-gabinete"
      ],
      "observacao": null
    },
    {
      "id": "secao:secao:1-1-redatores",
      "tipo": "Secao",
      "titulo": "Seção 1.1 — Quem eram os redatores do Gabinete de Leitura?",
      "aliases": [],
      "atributos": {
        "pagina_impressa_inicio": 5,
        "pagina_impressa_fim": 7,
        "capitulo_pai": "capitulo:1-continuar-se-a"
      },
      "status_epistemologico": "documentado",
      "evidence_ids": [
        "evidence:soares:2006:pdf-p9-12:redatores-gabinete"
      ],
      "observacao": null
    },
    {
      "id": "secao:secao:1-2-condicoes-producao",
      "tipo": "Secao",
      "titulo": "Seção 1.2 — As condições de produção da imprensa da época",
      "aliases": [],
      "atributos": {
        "pagina_impressa_inicio": 8,
        "pagina_impressa_fim": 12,
        "capitulo_pai": "capitulo:1-continuar-se-a"
      },
      "status_epistemologico": "documentado",
      "evidence_ids": [
        "evidence:soares:2006:pdf-p9-12:redatores-gabinete"
      ],
      "observacao": null
    },
    {
      "id": "secao:secao:2-1-gabinetes-corte-rj",
      "tipo": "Secao",
      "titulo": "Seção 2.1 — Os gabinetes de leitura chegam à corte do Rio de Janeiro",
      "aliases": [],
      "atributos": {
        "pagina_impressa_inicio": 20,
        "pagina_impressa_fim": 24,
        "capitulo_pai": "capitulo:2-o-que-e-gabinete"
      },
      "status_epistemologico": "documentado",
      "evidence_ids": [
        "evidence:soares:2006:pdf-p9-12:redatores-gabinete"
      ],
      "observacao": null
    },
    {
      "id": "periodico:gabinete-de-leitura",
      "tipo": "Periodico",